[
  {
    "id": "usr_3d2496d44c",
    "name": "Logan H",
    "age": 36,
    "gender": "male",
    "genderInterestedIn": [
      "female"
    ],
    "location": "WI",
    "locationFlexibility": "some",
    "lastUpdated": "2025-10-25"
  },
  {
    "id": "usr_844903a8aa",
    "name": "Monel",
    "age": 36,
    "gender": "female",
    "location": "Western USSeattlePortlandBerkeleyWAOregon",
    "locationFlexibility": "flexible",
    "lastUpdated": "2025-10-17"
  },
  {
    "id": "usr_c035b2c632",
    "name": "Anubhav Garg",
    "age": 28,
    "gender": "male",
    "genderInterestedIn": [
      "female"
    ],
    "location": "FlexibleAsia",
    "locationFlexibility": "flexible",
    "lastUpdated": "2025-10-15"
  },
  {
    "id": "usr_e0dd5e5430",
    "name": "Rahul Goyal",
    "age": 29,
    "gender": "male",
    "genderInterestedIn": [
      "female"
    ],
    "location": "Central EuropeBerlin",
    "locationFlexibility": "some",
    "lastUpdated": "2025-10-14"
  },
  {
    "id": "usr_610746137c",
    "name": "Blake Boles",
    "age": 43,
    "gender": "male",
    "genderInterestedIn": [
      "female"
    ],
    "location": "Flexible",
    "locationFlexibility": "flexible",
    "lastUpdated": "2025-10-14"
  },
  {
    "id": "usr_6a8d39dab4",
    "name": "Monel Chang",
    "age": 36,
    "gender": "female",
    "location": "North AmericaWestern USPortlandOregon",
    "locationFlexibility": "flexible",
    "lastUpdated": "2025-10-13"
  },
  {
    "id": "usr_de0a9ac6c0",
    "name": "Ori",
    "age": 35,
    "gender": "female",
    "genderInterestedIn": [
      "male"
    ],
    "location": "Central Europe",
    "locationFlexibility": "flexible",
    "lastUpdated": "2025-10-12"
  },
  {
    "id": "usr_b564e03b7c",
    "name": "Martin",
    "age": 28,
    "gender": "male",
    "genderInterestedIn": [
      "female"
    ],
    "location": "San Francisco Bay AreaNYCLondonCentral EuropeDCUKLos AngelesBerlinBarcelona, SpainNorth AmericaFlexibleBostonNYWestern USSeattleChicagoAsiaNJPhiladelphiaParis, FranceColoradoTorontoAustinPACanadaBrightonSouthern USVancouverTXPortlandMADenverBrazilAmsterdamWISouth of FranceCambridgeBerkeleyWAVancouver IslandSouth BayOxfordOregonNorth CarolinaDubaiSomervilleSeoulSacramentoOhioMadisonMadrid, SpainLadysmith BCIndianapolisGeorgiaAshevilleSydney AustraliaSwedenRibeirão BonitoONNew HavenNebraskaMontereyLubbockEwingCollingswoodCTRhode IslandMiamiIndonesiaNorwayIsraelSpain",
    "locationFlexibility": "flexible",
    "lastUpdated": "2025-10-11"
  },
  {
    "id": "usr_192e493212",
    "name": "Ruth",
    "age": 38,
    "gender": "female",
    "location": "Central Europe",
    "locationFlexibility": "some",
    "lastUpdated": "2025-10-11"
  },
  {
    "id": "usr_1519a2db20",
    "name": "Mark",
    "age": 35,
    "gender": "male",
    "genderInterestedIn": [
      "female"
    ],
    "location": "LondonUK",
    "locationFlexibility": "flexible",
    "lastUpdated": "2025-10-09"
  },
  {
    "id": "usr_d806dfaeba",
    "name": "Jackson",
    "age": 24,
    "gender": "male",
    "genderInterestedIn": [
      "female"
    ],
    "location": "Philadelphia",
    "locationFlexibility": "some",
    "lastUpdated": "2025-09-29"
  },
  {
    "id": "usr_d47f818c10",
    "name": "Owen Murphy",
    "age": 24,
    "gender": "male",
    "genderInterestedIn": [
      "female"
    ],
    "location": "Boston",
    "locationFlexibility": "none",
    "lastUpdated": "2025-09-29"
  },
  {
    "id": "usr_54fbd32c6b",
    "name": "Adam Jermyn",
    "age": 32,
    "gender": "male",
    "genderInterestedIn": [
      "female"
    ],
    "location": "Boston",
    "locationFlexibility": "some",
    "lastUpdated": "2025-09-29"
  },
  {
    "id": "usr_51524b91ad",
    "name": "Jamie",
    "age": 22,
    "gender": "male",
    "genderInterestedIn": [
      "female"
    ],
    "location": "San Francisco Bay AreaNorth AmericaBerkeley",
    "locationFlexibility": "flexible",
    "lastUpdated": "2025-09-24"
  },
  {
    "id": "usr_47e59f8ead",
    "name": "Jonathan Saunders",
    "age": 40,
    "gender": "male",
    "genderInterestedIn": [
      "female"
    ],
    "location": "San Francisco Bay AreaLos AngelesNorth AmericaFlexibleWestern USSacramentoGeorgiaMiami",
    "locationFlexibility": "flexible",
    "lastUpdated": "2025-09-22"
  },
  {
    "id": "usr_c3eafca9c8",
    "name": "Kayla",
    "age": 39,
    "gender": "female",
    "genderInterestedIn": [
      "male"
    ],
    "location": "DC",
    "locationFlexibility": "flexible",
    "lastUpdated": "2025-09-20"
  },
  {
    "id": "usr_41264277ca",
    "name": "Malvin G.",
    "age": 34,
    "gender": "male",
    "genderInterestedIn": [
      "female"
    ],
    "location": "San Francisco Bay AreaNYCLondonCentral EuropeDCUKLos AngelesBarcelona, SpainNorth AmericaFlexibleBostonNYWestern USSeattleChicagoNJPhiladelphiaParis, FranceColoradoTorontoAustinPACanadaSouthern USVancouverTXPortlandMADenverBrazilAmsterdamSouth of FranceWAVancouver IslandOxfordOregonNorth CarolinaSacramentoOhioMadrid, SpainIndianapolisGeorgiaSydney AustraliaSwedenRibeirão BonitoONNew HavenCollingswoodCTRhode IslandMiamiNorwayIsraelSpain",
    "locationFlexibility": "flexible",
    "lastUpdated": "2025-09-18"
  },
  {
    "id": "usr_e4f9b72476",
    "name": "Bryce",
    "age": 33,
    "gender": "male",
    "genderInterestedIn": [
      "female"
    ],
    "location": "Western US",
    "locationFlexibility": "none",
    "lastUpdated": "2025-09-18"
  },
  {
    "id": "usr_bc018c3ad0",
    "name": "Rory Katz",
    "age": 38,
    "gender": "female",
    "genderInterestedIn": [
      "male"
    ],
    "location": "San Francisco Bay Area",
    "locationFlexibility": "flexible",
    "lastUpdated": "2025-09-18"
  },
  {
    "id": "usr_447d37fff8",
    "name": "Zoé",
    "age": 23,
    "gender": "female",
    "location": "UK",
    "locationFlexibility": "flexible",
    "lastUpdated": "2025-09-14"
  },
  {
    "id": "usr_a77783fb9a",
    "name": "Nathan Nguyen",
    "age": 32,
    "gender": "male",
    "genderInterestedIn": [
      "female"
    ],
    "location": "NYC",
    "locationFlexibility": "some",
    "lastUpdated": "2025-09-13"
  },
  {
    "id": "usr_a036e18d2a",
    "name": "Xing Ye",
    "age": 29,
    "gender": "male",
    "genderInterestedIn": [
      "female"
    ],
    "location": "LondonUK",
    "locationFlexibility": "flexible",
    "lastUpdated": "2025-09-10"
  },
  {
    "id": "usr_105026f47d",
    "name": "George Wang",
    "age": 31,
    "gender": "male",
    "genderInterestedIn": [
      "female"
    ],
    "location": "San Francisco Bay AreaAustin",
    "locationFlexibility": "flexible",
    "lastUpdated": "2025-09-08"
  },
  {
    "id": "usr_24c970745d",
    "name": "Sarah Brinker",
    "age": 40,
    "gender": "female",
    "genderInterestedIn": [
      "male"
    ],
    "location": "San Francisco Bay Area",
    "locationFlexibility": "some",
    "lastUpdated": "2025-09-08"
  },
  {
    "id": "usr_639e152611",
    "name": "Jane Loy",
    "age": 37,
    "gender": "female",
    "genderInterestedIn": [
      "male"
    ],
    "location": "Los AngelesNorth AmericaBostonNYSeattleChicagoColoradoAustinPASomervilleSeoulSacramentoOhioGeorgiaAsheville",
    "locationFlexibility": "flexible",
    "lastUpdated": "2025-08-30"
  },
  {
    "id": "usr_b9d5083096",
    "name": "Martin",
    "age": 28,
    "gender": "male",
    "location": "Central EuropeBerlinFlexibleParis, FranceAmsterdamSouth of FranceSweden",
    "locationFlexibility": "flexible",
    "lastUpdated": "2025-08-29"
  },
  {
    "id": "usr_9b412a2cd6",
    "name": "Virginia Muthoni",
    "age": 29,
    "gender": "female",
    "genderInterestedIn": [
      "male"
    ],
    "location": "San Francisco Bay AreaNYCLondonCentral EuropeDCUKLos AngelesBerlinBarcelona, SpainNorth AmericaFlexibleBostonNYWestern USSeattleChicagoAsiaNJPhiladelphiaParis, FranceColoradoTorontoAustinPACanadaBrightonSouthern USVancouverTXPortlandMADenverBrazilAmsterdamWISouth of FranceCambridgeBerkeleyWAVancouver IslandSouth BayOxfordOregonNorth CarolinaDubaiSomervilleSeoulSacramentoOhioMadisonMadrid, SpainLadysmith BCIndianapolisGeorgiaAshevilleSydney AustraliaSwedenRibeirão BonitoONNew HavenNebraskaMontereyLubbockEwingCollingswoodCTRhode IslandMiamiIndonesiaNorwaySpain",
    "locationFlexibility": "flexible",
    "lastUpdated": "2025-08-27"
  },
  {
    "id": "usr_71e283059c",
    "name": "Robert Thompson",
    "age": 25,
    "gender": "male",
    "genderInterestedIn": [
      "female"
    ],
    "location": "San Francisco Bay Area",
    "locationFlexibility": "some",
    "lastUpdated": "2025-08-26"
  },
  {
    "id": "usr_af8ab3b8f1",
    "name": "Manuel",
    "age": 24,
    "gender": "male",
    "genderInterestedIn": [
      "female"
    ],
    "location": "San Francisco Bay Area",
    "locationFlexibility": "flexible",
    "lastUpdated": "2025-08-25"
  },
  {
    "id": "usr_429e56e228",
    "name": "Celeste",
    "age": 52,
    "gender": "female",
    "genderInterestedIn": [
      "male"
    ],
    "location": "San Francisco Bay Area",
    "locationFlexibility": "some",
    "lastUpdated": "2025-08-24"
  },
  {
    "id": "usr_9509748eba",
    "name": "Andy",
    "age": 35,
    "gender": "male",
    "genderInterestedIn": [
      "female"
    ],
    "location": "San Francisco Bay Area",
    "locationFlexibility": "flexible",
    "lastUpdated": "2025-08-18"
  },
  {
    "id": "usr_4b6527c962",
    "name": "S",
    "age": 29,
    "gender": "male",
    "genderInterestedIn": [
      "female"
    ],
    "location": "San Francisco Bay Area",
    "locationFlexibility": "flexible",
    "lastUpdated": "2025-08-18"
  },
  {
    "id": "usr_360d9c6df2",
    "name": "Yash",
    "age": 35,
    "gender": "male",
    "genderInterestedIn": [
      "female"
    ],
    "location": "San Francisco Bay Area",
    "locationFlexibility": "flexible",
    "lastUpdated": "2025-08-18"
  },
  {
    "id": "usr_2572d2ca14",
    "name": "Ben",
    "age": 35,
    "gender": "male",